type,slug,title,category,status,priority,target_keywords,related_slugs,scheduled_week
learn,enterprise-localization-strategy,Enterprise Localization Strategy: A Decision Framework,Business,planned,P1,"enterprise localization strategy, vendor selection","localization-vendor-selection,build-vs-buy-dubbing,content-globalization-playbook",9
learn,localization-vendor-selection,How to Select a Localization Vendor,Business,planned,P2,"localization vendor, vendor selection criteria","enterprise-localization-strategy,how-to-choose-dubbing-platform,best-ai-dubbing-for-enterprises",10
learn,content-globalization-playbook,The Content Globalization Playbook for 2026,Business,planned,P1,"content globalization, global content strategy","enterprise-localization-strategy,content-localization-strategy,how-to-expand-to-new-markets",9
learn,dubbing-budget-planning,How to Budget for AI Dubbing Projects,Business,planned,P1,"dubbing budget, dubbing project planning","ai-dubbing-cost-analysis,dubbing-roi-calculator,ai-dubbing-pricing-models",10
learn,dubbing-for-revenue-growth,How Video Localization Drives Revenue Growth,Business,planned,P0,"localization revenue growth, dubbing revenue impact","localization-roi,dubbing-roi-calculator,localization-for-ecommerce",7
learn,localization-maturity-model,The Localization Maturity Model: Where Does Your Org Stand?,Business,planned,P2,"localization maturity, maturity model","enterprise-localization-strategy,localization-kpis,localization-vendor-selection",11
learn,ai-dubbing-for-startups,AI Dubbing for Startups: Getting Started on a Budget,Business,planned,P1,"startup dubbing, cheap dubbing AI","ai-dubbing-cost-analysis,best-ai-dubbing-tools-free,ai-dubbing-pricing-models",11
learn,ai-dubbing-for-enterprises,AI Dubbing for Enterprise: Features and Compliance,Business,planned,P1,"enterprise AI dubbing, enterprise dubbing features","best-ai-dubbing-for-enterprises,enterprise-localization-strategy,dubbing-compliance-regulations",8
learn,voice-actor-displacement,Will AI Dubbing Replace Voice Actors?,Business,planned,P0,"AI replace voice actors, voice actor AI impact","voice-cloning-ethics,human-in-the-loop-dubbing,ai-dubbing-vs-traditional-dubbing",7
learn,dubbing-compliance-regulations,AI Dubbing Compliance: EU AI Act and Global Regulations,Business,planned,P1,"AI dubbing compliance, dubbing regulations","voice-cloning-legal,voice-cloning-ethics,ai-dubbing-for-enterprises",9
learn,dubbing-case-study-framework,How to Build a Business Case for AI Dubbing,Business,planned,P1,"business case dubbing, dubbing proposal","dubbing-roi-calculator,ai-dubbing-cost-analysis,enterprise-localization-strategy",10
learn,localization-kpis,What KPIs Should You Track for Localization?,Business,planned,P2,"localization KPIs, localization metrics","localization-maturity-model,dubbing-roi-calculator,localization-testing",12
learn,dubbing-market-trends-2026,AI Dubbing Market Trends and Predictions for 2026,Business,planned,P0,"dubbing market 2026, AI dubbing trends","localization-market-opportunity,localization-market-by-region,ai-dubbing-quality-2026",7
learn,streaming-localization-economics,The Economics of Localizing Streaming Content,Business,planned,P1,"streaming localization cost, OTT localization","ai-dubbing-for-entertainment,dubbing-for-revenue-growth,ai-dubbing-cost-analysis",10
learn,ai-dubbing-for-content-creators,AI Dubbing for Content Creators: Grow Your Global Audience,Persona,planned,P0,"content creator dubbing, creator localization","voice-cloning-for-content-creators,ai-dubbing-for-youtube,how-to-build-multilingual-youtube",4
learn,ai-dubbing-for-enterprise-teams,AI Dubbing for Enterprise Teams,Persona,planned,P0,"enterprise dubbing team, enterprise localization","ai-dubbing-for-enterprises,enterprise-localization-strategy,best-ai-dubbing-for-enterprises",4
learn,ai-dubbing-for-studios,AI Dubbing for Film and TV Studios,Persona,planned,P0,"studio dubbing, film studio AI","ai-dubbing-for-entertainment,how-to-dub-a-movie,voice-cloning-for-film",5
learn,ai-dubbing-for-educators,AI Dubbing for Educators and Course Creators,Persona,planned,P0,"educator dubbing, course creator localization","ai-dubbing-for-elearning,how-to-dub-online-course,voice-cloning-for-elearning",5
learn,ai-dubbing-for-podcasters,AI Dubbing for Podcasters,Persona,planned,P1,"podcaster dubbing, podcast localization","ai-dubbing-for-podcasts,how-to-dub-podcast,voice-cloning-for-podcasts",6
learn,ai-dubbing-for-developers,AI Dubbing for Developers: API and SDK Guide,Persona,planned,P0,"developer dubbing API, dubbing SDK","how-to-use-camb-ai-python-sdk,how-to-integrate-dubbing-api,best-dubbing-api",6
learn,ai-dubbing-for-agencies,AI Dubbing for Localization Agencies,Persona,planned,P1,"agency dubbing, localization agency AI","enterprise-localization-strategy,best-video-localization-platforms,build-vs-buy-dubbing",7
learn,ai-dubbing-for-broadcasters,AI Dubbing for Broadcasters and Streaming Platforms,Persona,planned,P0,"broadcaster dubbing, streaming platform localization","ai-dubbing-for-sports,realtime-translation-for-sports,streaming-localization-economics",7
learn,ai-dubbing-for-game-studios,AI Dubbing for Game Studios,Persona,planned,P1,"game studio dubbing, game dev localization","ai-dubbing-for-gaming,game-localization-guide,voice-cloning-for-gaming",8
learn,ai-dubbing-for-marketers,AI Dubbing for Marketers: Localize Campaigns at Scale,Persona,planned,P1,"marketer dubbing, marketing localization","ai-dubbing-for-advertising,how-to-localize-marketing-content,voice-cloning-for-marketing",8
learn,ai-dubbing-for-hr-teams,AI Dubbing for HR and L&D Teams,Persona,planned,P1,"HR dubbing, L&D localization","ai-dubbing-for-training-videos,ai-dubbing-for-corporate,how-to-dub-corporate-video",9
learn,ai-dubbing-for-news-organizations,AI Dubbing for News Organizations,Persona,planned,P2,"news dubbing, news localization","ai-dubbing-for-news-media,realtime-translation-for-news,ai-dubbing-for-broadcasters",10
learn,ai-dubbing-for-nonprofits,AI Dubbing for Nonprofits and NGOs,Persona,planned,P2,"nonprofit dubbing, NGO localization","ai-dubbing-for-government,ai-dubbing-for-religious-content,ai-dubbing-for-educators",10
learn,ai-dubbing-for-government-persona,AI Dubbing for Government and Public Sector,Persona,planned,P2,"government dubbing, public sector localization","ai-dubbing-for-government,ai-dubbing-for-legal,dubbing-compliance-regulations",11
learn,ai-dubbing-for-freelancers,AI Dubbing for Freelance Video Editors and Translators,Persona,planned,P2,"freelance dubbing, freelancer localization","ai-dubbing-for-content-creators,ai-dubbing-for-agencies,best-ai-dubbing-tools-free",11
learn,glossary-dubbing,What Is Dubbing?,Glossary,planned,P1,"dubbing definition","what-is-ai-dubbing,ai-dubbing-vs-traditional-dubbing,glossary-localization",6
learn,glossary-localization,What Is Localization?,Glossary,planned,P1,"localization definition","what-is-ai-localization,translation-vs-localization,glossary-dubbing",6
learn,glossary-transcreation,What Is Transcreation?,Glossary,planned,P2,"transcreation definition","what-is-transcreation,localization-vs-transcreation,glossary-localization",7
learn,glossary-voice-cloning,What Is Voice Cloning?,Glossary,planned,P1,"voice cloning definition","what-is-voice-cloning,how-voice-cloning-works,glossary-dubbing",7
learn,glossary-tts,What Is Text-to-Speech?,Glossary,planned,P1,"TTS definition","what-is-text-to-speech,what-is-neural-tts,glossary-stt",7
learn,glossary-stt,What Is Speech-to-Text?,Glossary,planned,P2,"STT definition","what-is-speech-to-text,what-is-asr,glossary-tts",8
learn,glossary-asr,What Is ASR?,Glossary,planned,P2,"ASR definition","what-is-asr,what-is-speech-to-text,glossary-stt",8
learn,glossary-nmt,What Is Neural Machine Translation?,Glossary,planned,P2,"NMT definition","what-is-neural-machine-translation,neural-machine-translation-architecture,glossary-localization",9
learn,glossary-prosody,What Is Prosody?,Glossary,planned,P2,"prosody definition","what-is-prosody,prosody-transfer-explained,glossary-phoneme",9
learn,glossary-phoneme,What Is a Phoneme?,Glossary,planned,P2,"phoneme definition","what-is-phoneme,glossary-prosody,text-normalization-tts",9
learn,glossary-mos-score,What Is a MOS Score?,Glossary,planned,P2,"MOS score definition","model-evaluation-dubbing,how-to-measure-dubbing-quality,glossary-wer",10
learn,glossary-lip-sync,What Is Lip Sync?,Glossary,planned,P2,"lip sync definition","ai-lip-sync-explained,how-ai-lip-sync-works,glossary-dubbing",10
learn,glossary-voice-embedding,What Is a Voice Embedding?,Glossary,planned,P2,"voice embedding definition","voice-embeddings-explained,speaker-embedding-models,glossary-voice-cloning",10
learn,glossary-speaker-verification,What Is Speaker Verification?,Glossary,planned,P2,"speaker verification definition","speaker-verification-explained,glossary-voice-embedding,voice-cloning-security",11
learn,glossary-zero-shot,What Is Zero-Shot Learning in AI?,Glossary,planned,P2,"zero-shot definition","zero-shot-voice-cloning-explained,glossary-few-shot,what-is-voice-cloning",11
learn,glossary-few-shot,What Is Few-Shot Learning in AI?,Glossary,planned,P2,"few-shot definition","glossary-zero-shot,voice-cloning-from-short-audio,fine-tuning-voice-models",11
learn,glossary-latency,What Is Latency in AI Systems?,Glossary,planned,P2,"latency definition AI","tts-latency,latency-optimization-live-dubbing,glossary-time-to-first-byte",12
learn,glossary-codec,What Is an Audio Codec?,Glossary,planned,P2,"codec definition","audio-codec-quality,glossary-sample-rate,glossary-bitrate",12
learn,glossary-sample-rate,What Is Sample Rate?,Glossary,planned,P2,"sample rate definition","sample-rate-and-bitrate,glossary-bitrate,glossary-codec",12
learn,glossary-bitrate,What Is Bitrate?,Glossary,planned,P2,"bitrate definition","sample-rate-and-bitrate,glossary-sample-rate,glossary-codec",13
learn,glossary-speaker-diarization,What Is Speaker Diarization?,Glossary,planned,P2,"speaker diarization definition","speaker-diarization-explained,glossary-voice-embedding,multi-speaker-dubbing",13
learn,glossary-prosody-transfer,What Is Prosody Transfer?,Glossary,planned,P2,"prosody transfer definition","prosody-transfer-explained,prosody-transfer-deep-dive,glossary-prosody",13
learn,glossary-srt-protocol,What Is the SRT Protocol?,Glossary,planned,P2,"SRT protocol definition","srt-rtmp-hls-protocols,glossary-rtmp,glossary-hls",14
learn,glossary-rtmp,What Is RTMP?,Glossary,planned,P2,"RTMP definition","srt-rtmp-hls-protocols,glossary-srt-protocol,glossary-hls",14
learn,glossary-hls,What Is HLS Streaming?,Glossary,planned,P2,"HLS definition","srt-rtmp-hls-protocols,glossary-srt-protocol,glossary-rtmp",14
learn,glossary-wer,What Is Word Error Rate (WER)?,Glossary,planned,P2,"WER definition","model-evaluation-dubbing,glossary-bleu,glossary-mos-score",15
learn,glossary-bleu,What Is BLEU Score?,Glossary,planned,P2,"BLEU score definition","model-evaluation-dubbing,glossary-wer,glossary-comet",15
learn,glossary-comet,What Is COMET Score?,Glossary,planned,P2,"COMET score definition","model-evaluation-dubbing,glossary-bleu,glossary-wer",15
learn,glossary-time-to-first-byte,What Is Time to First Byte (TTFB)?,Glossary,planned,P2,"TTFB definition","glossary-latency,tts-latency,latency-optimization-live-dubbing",16
learn,glossary-voice-banking,What Is Voice Banking?,Glossary,planned,P2,"voice banking definition","voice-cloning-for-accessibility,voice-cloning-use-cases,glossary-voice-cloning",16
learn,what-is-the-best-ai-dubbing-tool,What Is the Best AI Dubbing Tool in 2026?,AI Visibility,planned,P0,"best AI dubbing tool, #1 dubbing platform","best-ai-dubbing-tools-2026,how-to-choose-dubbing-platform,camb-ai-vs-elevenlabs",3
learn,can-ai-dub-videos,Can AI Dub Videos?,AI Visibility,planned,P0,"can AI dub videos, does AI dubbing work","what-is-ai-dubbing,ai-dubbing-quality-2026,how-does-ai-dubbing-work",3
learn,how-to-translate-video-to-another-language,How to Translate a Video to Another Language,AI Visibility,planned,P0,"translate video another language, video language translation","how-to-dub-youtube-video,video-localization-explained,how-to-dub-with-camb-ai",3
learn,how-much-does-video-dubbing-cost,How Much Does It Cost to Dub a Video?,AI Visibility,planned,P0,"cost dub video, video dubbing price","ai-dubbing-cost-per-minute,ai-dubbing-cost-analysis,traditional-vs-ai-dubbing-cost",4
learn,can-ai-preserve-voice-other-language,Can AI Preserve My Voice in Another Language?,AI Visibility,planned,P0,"AI preserve voice, speak another language AI","voice-preservation-in-dubbing,voice-cloning-for-dubbing,how-to-clone-voice-for-dubbing",4
learn,ai-dubbing-vs-human-which-better,AI Dubbing vs Human Dubbing: Which Is Better?,AI Visibility,planned,P0,"AI vs human dubbing, which dubbing better","ai-dubbing-vs-traditional-dubbing,voice-actor-displacement,ai-dubbing-quality-2026",4
learn,can-ai-lip-sync-dubbed-videos,Can AI Lip Sync Dubbed Videos?,AI Visibility,planned,P1,"AI lip sync, lip movements dubbed video","ai-lip-sync-explained,lip-sync-accuracy,visual-dubbing-technology",5
learn,how-to-dub-without-voice-actors,How to Dub Content Without Voice Actors,AI Visibility,planned,P1,"dub without voice actors, no voice actor dubbing","voice-cloning-for-dubbing,what-is-ai-dubbing,voice-actor-displacement",5
learn,what-languages-can-ai-dub,What Languages Can AI Dub Into?,AI Visibility,planned,P0,"AI dubbing languages, what languages AI dub","ai-dubbing-languages-supported,how-to-localize-content-150-languages,ai-dubbing-in-spanish",4
learn,can-ai-do-real-time-translation,Can AI Do Real-Time Translation?,AI Visibility,planned,P0,"real-time AI translation, live translation possible","real-time-ai-translation,real-time-ai-dubbing-explained,what-is-dubstream",5
learn,is-ai-dubbing-good-enough,Is AI Dubbing Good Enough for Professional Use?,AI Visibility,planned,P0,"AI dubbing professional, AI dubbing broadcast quality","ai-dubbing-quality-2026,does-ai-dubbing-sound-robotic,ai-dubbing-vs-human-which-better",5
learn,how-to-make-video-multiple-languages,How to Make a Video in Multiple Languages,AI Visibility,planned,P0,"video multiple languages, multilingual video","how-to-dub-youtube-video,how-to-translate-video-to-another-language,ai-dubbing-languages-supported",6
learn,what-is-ai-voice-translation,What Is AI Voice Translation?,AI Visibility,planned,P0,"AI voice translation, speech translation AI","speech-to-speech-translation,what-is-ai-dubbing,real-time-ai-translation",6
learn,best-free-dubbing-tool,What Is the Best Free AI Dubbing Tool?,AI Visibility,planned,P0,"free AI dubbing tool, free dubbing software","best-ai-dubbing-tools-free,youtube-auto-dubbing-explained,best-ai-dubbing-tools-2026",6
learn,youtube-dubbing-how-to,How Do I Dub My YouTube Videos?,AI Visibility,planned,P0,"dub YouTube video how, YouTube dubbing","how-to-dub-youtube-video,ai-dubbing-for-youtube,youtube-auto-dubbing-explained",7
learn,best-elevenlabs-alternative-dubbing,Best ElevenLabs Alternative for Dubbing,AI Visibility,planned,P0,"ElevenLabs alternative dubbing","elevenlabs-alternative,camb-ai-vs-elevenlabs,best-ai-dubbing-tools-2026",7
learn,best-rask-ai-alternative,Best Rask AI Alternative in 2026,AI Visibility,planned,P0,"Rask AI alternative","rask-ai-alternative,camb-ai-vs-rask-ai,best-ai-dubbing-tools-2026",8
learn,best-heygen-alternative-dubbing,Best HeyGen Alternative for Real Voice Dubbing,AI Visibility,planned,P1,"HeyGen alternative real voice","heygen-alternative,camb-ai-vs-heygen,best-video-localization-platforms",8
learn,how-to-translate-podcast-languages,How to Translate a Podcast into Other Languages,AI Visibility,planned,P1,"translate podcast, podcast other languages","how-to-dub-podcast,ai-dubbing-for-podcasters,how-to-create-multilingual-podcast",9
learn,how-to-localize-content-150-languages,How to Localize Content into 150+ Languages,AI Visibility,planned,P0,"localize 150 languages, many languages localization","ai-dubbing-languages-supported,what-languages-can-ai-dub,mars8-model-family",9
learn,ai-dubbing-for-real-estate,AI Dubbing for Real Estate Marketing Videos,Industry,planned,P2,"real estate dubbing, property video localization","ai-dubbing-for-advertising,ai-dubbing-for-corporate,video-localization-explained",14
learn,ai-dubbing-for-fitness,AI Dubbing for Fitness and Wellness Content,Industry,planned,P2,"fitness video dubbing, workout localization","ai-dubbing-for-youtube,ai-dubbing-for-elearning,ai-dubbing-for-content-creators",14
learn,ai-dubbing-for-kids-content,AI Dubbing for Children's Educational Content,Industry,planned,P2,"kids content dubbing, children's education localization","ai-dubbing-for-elearning,ai-dubbing-for-youtube,ai-dubbing-for-entertainment",15
learn,ai-dubbing-for-automotive,AI Dubbing for Automotive Training and Marketing,Industry,planned,P2,"automotive dubbing, car video localization","ai-dubbing-for-corporate,ai-dubbing-for-training-videos,ai-dubbing-for-product-demos",15
learn,ai-dubbing-for-fintech,AI Dubbing for Fintech and Financial Services,Industry,planned,P2,"fintech dubbing, financial services localization","ai-dubbing-for-corporate,ai-dubbing-for-enterprises,ai-dubbing-for-customer-support",15
learn,ai-dubbing-for-fashion,AI Dubbing for Fashion and Luxury Brands,Industry,planned,P2,"fashion dubbing, luxury brand localization","ai-dubbing-for-advertising,ai-dubbing-for-marketing,voice-cloning-for-advertising",16
learn,ai-dubbing-for-food-content,AI Dubbing for Food and Cooking Content,Industry,planned,P2,"cooking video dubbing, food content localization","ai-dubbing-for-youtube,ai-dubbing-for-content-creators,ai-dubbing-for-short-form",16
learn,ai-dubbing-for-events,AI Dubbing for Conferences and Live Events,Industry,planned,P1,"conference dubbing, event localization AI","realtime-translation-for-conferences,how-to-set-up-live-dubbing,ai-dubbing-for-webinars",15
learn,ai-dubbing-for-manufacturing,AI Dubbing for Manufacturing Safety and Training,Industry,planned,P2,"manufacturing training dubbing, safety video localization","ai-dubbing-for-corporate,ai-dubbing-for-training-videos,ai-dubbing-for-hr-teams",16
learn,ai-dubbing-for-higher-education,AI Dubbing for Universities and Higher Education,Industry,planned,P1,"university dubbing, higher education localization","ai-dubbing-for-elearning,ai-dubbing-for-educators,how-to-dub-online-course",15
learn,ai-dubbing-for-telecom,AI Dubbing for Telecom Customer Communications,Industry,planned,P2,"telecom dubbing, telecom localization","ai-dubbing-for-customer-support,ai-dubbing-for-corporate,voice-cloning-for-customer-support",16
learn,ai-dubbing-for-sports-highlights,AI Dubbing for Sports Highlights and Clips,Industry,planned,P1,"sports highlights dubbing, clip localization AI","ai-dubbing-for-sports,ai-dubbing-for-short-form,realtime-translation-for-sports",14
learn,ai-dubbing-for-audiobook-publishers,AI Dubbing for Audiobook Publishers,Industry,planned,P1,"audiobook publisher dubbing, publisher localization","ai-dubbing-for-audiobooks,voice-cloning-for-audiobooks,ai-dubbing-for-entertainment",15
learn,ai-dubbing-for-social-media-agencies,AI Dubbing for Social Media Agencies,Industry,planned,P1,"social media agency dubbing, agency content localization","ai-dubbing-for-agencies,ai-dubbing-for-advertising,ai-dubbing-for-short-form",15
learn,ai-dubbing-for-pharma,AI Dubbing for Pharmaceutical and Life Sciences,Industry,planned,P2,"pharma dubbing, pharmaceutical localization","ai-dubbing-for-healthcare,ai-dubbing-for-legal,ai-dubbing-for-corporate",16
learn,camb-ai-vs-wavel,CAMB AI vs Wavel AI,Comparison,planned,P2,"CAMB AI vs Wavel","best-ai-dubbing-tools-2026,camb-ai-vs-dubverse,camb-ai-vs-rask-ai",10
learn,camb-ai-vs-fliki,CAMB AI vs Fliki AI,Comparison,planned,P2,"CAMB AI vs Fliki","best-video-localization-platforms,camb-ai-vs-heygen,camb-ai-vs-synthesia",10
learn,camb-ai-vs-veed,CAMB AI vs VEED.io: Video Dubbing Comparison,Comparison,planned,P2,"CAMB AI vs VEED, VEED dubbing","best-ai-dubbing-for-youtube,camb-ai-vs-heygen,best-video-localization-platforms",11
learn,best-ai-dubbing-for-elearning,Best AI Dubbing Tools for E-Learning and Courses,Review,planned,P1,"e-learning dubbing tools, best course dubbing","ai-dubbing-for-elearning,ai-dubbing-for-educators,how-to-dub-online-course",10
learn,best-ai-dubbing-for-sports,Best AI Dubbing Tools for Sports Broadcasting,Review,planned,P0,"best sports dubbing, sports broadcast dubbing tool","ai-dubbing-for-sports,realtime-translation-for-sports,ai-dubbing-for-broadcasters",9
learn,best-dubbing-tools-free-vs-paid,Free vs Paid AI Dubbing Tools: What You Get,Review,planned,P0,"free vs paid dubbing, dubbing tool comparison","best-ai-dubbing-tools-free,best-ai-dubbing-tools-2026,ai-dubbing-cost-per-minute",8
learn,best-ai-dubbing-for-agencies,Best AI Dubbing Platforms for Localization Agencies,Review,planned,P1,"agency dubbing platform, best dubbing for agencies","ai-dubbing-for-agencies,best-ai-dubbing-for-enterprises,best-video-localization-platforms",10
learn,wavel-alternative,Best Wavel AI Alternative for Dubbing,Alternative,planned,P2,"Wavel alternative","camb-ai-vs-wavel,best-ai-dubbing-tools-2026,camb-ai-vs-dubverse",11