type,slug,title,category,status,priority,target_keywords,related_slugs,scheduled_week
blog,how-to-dub-a-movie-with-ai,How to Dub a Movie with AI,Use Case,outlined,P0,"how to dub a movie, AI movie dubbing, dub film AI","ai-dubbing-for-entertainment,how-ai-dubbing-pipeline-works,what-is-ai-dubbing",1
blog,ai-dubbing-for-live-sports-broadcasting,AI Dubbing for Live Sports Broadcasting,Use Case,outlined,P0,"AI dubbing sports, live sports dubbing, sports commentary AI","realtime-translation-for-sports,ai-dubbing-for-sports,what-is-dubstream",1
blog,real-time-translation-for-international-conferences,Real-Time Translation for International Conferences,Use Case,outlined,P0,"real-time translation conference, AI conference interpreter, live translation events","realtime-translation-for-conferences,real-time-ai-dubbing-explained,how-to-set-up-live-dubbing",2
blog,ai-voice-cloning-for-podcast-localization,AI Voice Cloning for Podcast Localization,Use Case,outlined,P0,"voice cloning podcast, podcast translation AI, localize podcast","voice-cloning-for-podcasts,ai-dubbing-for-podcasts,how-to-dub-podcast",2
blog,how-to-localize-your-app-in-50-plus-languages,How to Localize Your App in 50+ Languages,Use Case,outlined,P0,"localize app, app localization AI, multilingual app","app-localization-guide,localization-for-saas,how-to-localize-app",3
blog,ai-dubbing-roi-calculator-cost-savings-breakdown,AI Dubbing ROI Calculator: Cost Savings Breakdown,Business,outlined,P0,"AI dubbing ROI, dubbing cost savings, dubbing calculator","ai-dubbing-cost-analysis,traditional-vs-ai-dubbing-cost,dubbing-roi-calculator",3
blog,what-is-zero-shot-ai-dubbing-technology-explained,What Is Zero-Shot AI Dubbing? Technology Explained,Technical,outlined,P0,"zero-shot dubbing, zero-shot voice cloning, AI dubbing technology","zero-shot-voice-cloning-explained,how-ai-dubbing-pipeline-works,mars8-model-family",4
blog,the-complete-guide-to-ai-localization-in-2026,The Complete Guide to AI Localization in 2026,Strategy,outlined,P0,"AI localization guide, localization 2026, complete localization guide","what-is-ai-localization,content-localization-strategy,localization-market-opportunity",4
blog,ai-dubbing-for-e-learning-localize-courses-at-scale,AI Dubbing for E-Learning: Localize Courses at Scale,Use Case,outlined,P0,"AI dubbing e-learning, online course dubbing, e-learning localization","ai-dubbing-for-elearning,how-to-dub-online-course,voice-cloning-for-elearning",5
blog,voice-cloning-ethics-and-safety-what-you-need-to-know,Voice Cloning Ethics & Safety: What You Need to Know,Trust,outlined,P0,"voice cloning ethics, AI voice safety, voice cloning consent","voice-cloning-ethics,voice-cloning-legal,voice-cloning-deepfake-difference",5
blog,youtube-auto-dubbing-vs-professional-ai-dubbing-tools,How YouTube's Auto-Dubbing Compares to Professional AI Dubbing Tools,Comparison,planned,P0,"YouTube auto dubbing vs professional, YouTube dubbing comparison, auto dub vs CAMB AI","youtube-auto-dubbing-explained,youtube-auto-dubbing-vs-professional,best-ai-dubbing-for-youtube",6
blog,ai-dubbing-transforming-330b-streaming-industry,How AI Dubbing Is Transforming the $330B Streaming Industry,Industry,planned,P0,"AI dubbing streaming, streaming localization, OTT dubbing","streaming-localization-economics,ai-dubbing-for-entertainment,dubbing-market-trends-2026",6
blog,creators-guide-monetizing-content-150-languages,The Creator's Guide to Monetizing Content in 150+ Languages,Creator,planned,P0,"creator localization, monetize multilingual content, global creator economy","ai-dubbing-for-content-creators,how-to-build-multilingual-youtube,voice-cloning-for-content-creators",7
blog,how-imax-uses-ai-to-localize-documentaries,How IMAX Uses AI to Localize Documentaries for Global Audiences,Case Study,planned,P0,"IMAX AI dubbing, IMAX localization, documentary dubbing AI","ai-dubbing-for-documentaries,ai-dubbing-for-entertainment,how-to-dub-documentary",7
blog,inside-mls-first-ai-dubbed-live-sports-broadcast,Inside MLS's First AI-Dubbed Live Sports Broadcast,Case Study,planned,P0,"MLS AI dubbing, MLS live dubbing, sports broadcast AI","ai-dubbing-for-sports,realtime-translation-for-sports,how-real-time-ai-dubbing-works",8
blog,how-fancode-launched-indias-first-ai-multilingual-cricket,How FanCode Launched India's First AI Multilingual Cricket Commentary,Case Study,planned,P0,"FanCode AI dubbing, cricket commentary AI, India sports localization","ai-dubbing-for-sports,ai-dubbing-in-hindi,realtime-translation-for-sports",8
blog,ai-dubbing-for-gaming-localized-voice-acting-drives-revenue,AI Dubbing for Gaming: Why Localized Voice Acting Drives 2-3x Revenue,Industry,planned,P0,"game dubbing AI, game localization voice, gaming voice acting AI","ai-dubbing-for-gaming,voice-cloning-for-gaming,how-to-localize-game",9
blog,how-to-dub-youtube-channel-10-languages-weekend,How to Dub Your YouTube Channel Into 10 Languages in a Weekend,How-To,planned,P0,"dub YouTube channel, YouTube multiple languages, YouTube dubbing tutorial","how-to-dub-youtube-video,ai-dubbing-for-youtube,how-to-build-multilingual-youtube",9
blog,ai-dubbing-for-corporate-training-global-workforce,AI Dubbing for Corporate Training: Reach Your Global Workforce,Industry,planned,P1,"corporate training dubbing, L&D localization, employee training AI","ai-dubbing-for-corporate,ai-dubbing-for-training-videos,ai-dubbing-for-hr-teams",10
blog,how-ligue-1-scaled-football-commentary-new-markets,How Ligue 1 Scaled Football Commentary to New Markets with AI,Case Study,planned,P1,"Ligue 1 AI dubbing, football commentary AI, soccer localization","ai-dubbing-for-sports,realtime-translation-for-sports,ai-dubbing-in-french",10
blog,mars8-vs-elevenlabs-vs-sonic-voice-cloning-benchmarked,MARS8 vs ElevenLabs vs Sonic: Voice Cloning Quality Benchmarked,Technical,planned,P0,"MARS8 vs ElevenLabs, voice cloning benchmark, voice cloning quality comparison","voice-cloning-quality-comparison,camb-ai-vs-elevenlabs,mars8-model-family",11
blog,how-real-time-ai-dubbing-works-dubstream-architecture,How Real-Time AI Dubbing Works: The DubStream Architecture,Technical,planned,P0,"DubStream architecture, real-time dubbing technology, live dubbing how it works","streaming-architecture-dubstream,what-is-dubstream,real-time-ai-dubbing-explained",11
blog,voice-cloning-from-2-3-seconds-audio-mars8-pro,Voice Cloning from 2.3 Seconds of Audio: How MARS8-Pro Works,Technical,planned,P0,"voice cloning 2 seconds, MARS8-Pro, minimal audio voice clone","voice-cloning-from-short-audio,voice-cloning-architecture,mars8-model-family",12
blog,multi-speaker-isolation-overlapping-voices-live-sports,Multi-Speaker Isolation: How AI Handles Overlapping Voices in Live Sports,Technical,planned,P0,"multi-speaker isolation, overlapping voices AI, speaker separation sports","multi-speaker-dubbing,speaker-diarization-explained,ai-dubbing-for-sports",12
blog,on-device-ai-dubbing-mars8-nano-edge-deployment,On-Device AI Dubbing: What MARS8-Nano Means for Edge Deployment,Technical,planned,P1,"MARS8-Nano, on-device dubbing, edge AI dubbing","edge-deployment-ai-dubbing,mars8-model-family,latency-optimization-live-dubbing",13
blog,speech-to-speech-pipeline-how-ai-dubbing-works-end-to-end,The Speech-to-Speech Pipeline: How AI Dubbing Actually Works End-to-End,Technical,planned,P0,"speech to speech pipeline, AI dubbing pipeline, dubbing end to end","how-ai-dubbing-pipeline-works,speech-to-speech-translation,how-does-ai-dubbing-work",13
blog,ai-dubbing-pricing-2026-cost-and-budget,AI Dubbing Pricing in 2026: What It Costs and How to Budget,Business,planned,P0,"AI dubbing pricing 2026, dubbing cost, how much dubbing costs","ai-dubbing-cost-analysis,ai-dubbing-pricing-models,ai-dubbing-cost-per-minute",14
blog,build-vs-buy-in-house-dubbing-or-platform,Build vs Buy: Should You Build In-House Dubbing or Use a Platform?,Business,planned,P0,"build vs buy dubbing, in-house dubbing, dubbing platform","build-vs-buy-dubbing,how-to-choose-dubbing-platform,enterprise-localization-strategy",14
blog,how-to-choose-ai-dubbing-platform-enterprise-buyers-guide,How to Choose an AI Dubbing Platform: The Enterprise Buyer's Guide,Business,planned,P0,"choose dubbing platform, enterprise dubbing buyer guide, dubbing vendor selection","ai-dubbing-for-enterprises,enterprise-localization-strategy,localization-vendor-selection",15
blog,roi-of-video-localization-data-500-enterprise-deployments,The ROI of Video Localization: Data from 500+ Enterprise Deployments,Business,planned,P0,"video localization ROI, enterprise dubbing ROI, localization data","dubbing-roi-calculator,dubbing-for-revenue-growth,localization-roi",15
blog,why-80-percent-online-courses-english-only-how-ai-fixes-that,Why 80% of Online Courses Are English-Only (And How AI Fixes That),Thought Leadership,planned,P1,"online courses English only, e-learning localization gap, course translation","ai-dubbing-for-elearning,how-to-dub-online-course,ai-dubbing-for-educators",16
blog,state-of-ai-dubbing-2026-market-technology-whats-next,The State of AI Dubbing in 2026: Market Technology and What's Next,Thought Leadership,planned,P0,"state of AI dubbing 2026, AI dubbing market, dubbing trends","dubbing-market-trends-2026,localization-market-opportunity,ai-dubbing-quality-2026",16
blog,will-ai-replace-voice-actors-reality-2026,Will AI Replace Voice Actors? The Reality of AI Dubbing in 2026,Thought Leadership,planned,P0,"AI replace voice actors, voice actors AI, future voice acting","voice-actor-displacement,voice-cloning-ethics,ai-dubbing-vs-human-which-better",17
blog,deepfake-concerns-shaping-responsible-voice-cloning,How Deepfake Concerns Are Shaping Responsible Voice Cloning,Thought Leadership,planned,P1,"deepfake voice cloning, responsible AI voice, voice cloning safety","voice-cloning-deepfake-difference,voice-cloning-security,voice-cloning-ethics",17
blog,future-of-live-sports-real-time-ai-commentary-every-language,The Future of Live Sports: Real-Time AI Commentary in Every Language,Thought Leadership,planned,P0,"future live sports AI, real-time sports commentary, multilingual sports","realtime-translation-for-sports,ai-dubbing-for-sports,ai-dubbing-for-esports",18
blog,why-76-percent-consumers-demand-native-language-content,Why 76% of Consumers Demand Native Language Content,Thought Leadership,planned,P0,"native language content demand, consumer language preference, localization statistics","localization-roi,dubbing-for-revenue-growth,localization-for-ecommerce",18
blog,getting-started-with-camb-ai-api-developers-guide,Getting Started with the CAMB AI API: A Developer's Guide,Developer,planned,P0,"CAMB AI API, developer guide CAMB AI, API getting started","how-to-use-camb-ai-python-sdk,how-to-integrate-dubbing-api,what-is-dubbing-api",19
blog,building-multilingual-video-pipeline-camb-ai-sdks,Building a Multilingual Video Pipeline with CAMB AI's SDKs,Developer,planned,P0,"CAMB AI SDK, multilingual video pipeline, dubbing SDK","how-to-use-camb-ai-python-sdk,how-to-use-camb-ai-node-sdk,how-to-batch-dub-video-library",19
blog,how-to-integrate-ai-dubbing-existing-video-workflow,How to Integrate AI Dubbing into Your Existing Video Workflow,Developer,planned,P1,"integrate AI dubbing, dubbing workflow integration, video workflow API","how-to-integrate-dubbing-api,dubbing-workflow-best-practices,api-architecture-dubbing-at-scale",20
blog,real-time-dubbing-srt-rtmp-dubstream-integration-guide,Real-Time Dubbing via SRT/RTMP: A DubStream Integration Guide,Developer,planned,P1,"SRT dubbing, RTMP dubbing, DubStream integration","how-to-set-up-srt-rtmp-dubbing,srt-rtmp-hls-protocols,streaming-architecture-dubstream",20
learn,what-is-ai-dubbing,What Is AI Dubbing?,Fundamentals,planned,P0,"what is AI dubbing, AI dubbing definition","how-does-ai-dubbing-work,ai-dubbing-vs-traditional-dubbing,ai-dubbing-quality-2026",1
learn,how-does-ai-dubbing-work,How Does AI Dubbing Work?,Fundamentals,planned,P0,"how does AI dubbing work, AI dubbing process","what-is-ai-dubbing,how-ai-dubbing-pipeline-works,speech-to-speech-translation",1
learn,ai-dubbing-vs-traditional-dubbing,AI Dubbing vs Traditional Dubbing: Key Differences,Fundamentals,planned,P0,"AI dubbing vs traditional, AI vs human dubbing","what-is-ai-dubbing,traditional-vs-ai-dubbing-cost,ai-dubbing-vs-human-which-better",1
learn,ai-dubbing-vs-subtitles,AI Dubbing vs Subtitles: Which Is Better?,Fundamentals,planned,P0,"dubbing vs subtitles, AI dubbing or subtitles","what-is-ai-dubbing,subtitle-translation-vs-dubbing,ai-dubbing-vs-voiceover",2
learn,ai-dubbing-vs-voiceover,AI Dubbing vs Voiceover: What Is the Difference?,Fundamentals,planned,P1,"dubbing vs voiceover, AI voiceover","ai-dubbing-vs-subtitles,what-is-ai-dubbing,ai-dubbing-for-video",2
learn,ai-dubbing-quality-2026,How Good Is AI Dubbing Quality in 2026?,Fundamentals,planned,P0,"AI dubbing quality, is AI dubbing good","what-is-ai-dubbing,does-ai-dubbing-sound-robotic,is-ai-dubbing-good-enough",2
learn,ai-dubbing-cost-per-minute,How Much Does AI Dubbing Cost Per Minute?,Fundamentals,planned,P0,"AI dubbing cost per minute, dubbing pricing","ai-dubbing-cost-analysis,traditional-vs-ai-dubbing-cost,how-much-does-video-dubbing-cost",2
learn,ai-dubbing-accuracy,How Accurate Is AI Dubbing Translation?,Fundamentals,planned,P1,"AI dubbing accuracy, AI translation accuracy","ai-dubbing-quality-2026,how-to-measure-dubbing-quality,model-evaluation-dubbing",3
learn,real-time-ai-dubbing-explained,What Is Real-Time AI Dubbing?,Fundamentals,planned,P0,"real-time AI dubbing, live dubbing AI","what-is-dubstream,async-vs-realtime-dubbing,can-ai-do-real-time-translation",3
learn,async-vs-realtime-dubbing,Async vs Real-Time AI Dubbing: When to Use Each,Fundamentals,planned,P1,"async dubbing vs real-time, batch vs live dubbing","real-time-ai-dubbing-explained,what-is-dubstream,what-is-dubstudio",3
learn,ai-dubbing-for-video,AI Dubbing for Video: Complete Overview,Fundamentals,planned,P1,"AI video dubbing, dub video AI","what-is-ai-dubbing,video-localization-explained,how-to-translate-video-to-another-language",3
learn,ai-dubbing-for-audio,AI Dubbing for Audio-Only Content,Fundamentals,planned,P1,"AI audio dubbing, audio translation AI","audio-localization-explained,ai-dubbing-for-podcasts,ai-dubbing-for-audiobooks",4
learn,ai-dubbing-for-live-streaming,AI Dubbing for Live Streaming,Fundamentals,planned,P0,"live stream dubbing, live streaming translation","what-is-dubstream,real-time-ai-dubbing-explained,ai-dubbing-for-twitch",4
learn,what-is-dubstream,What Is DubStream? Real-Time Dubbing Explained,Fundamentals,planned,P0,"DubStream, CAMB AI DubStream","real-time-ai-dubbing-explained,how-to-use-dubstream,streaming-architecture-dubstream",4
learn,what-is-dubstudio,What Is DubStudio? Post-Production Dubbing,Fundamentals,planned,P0,"DubStudio, CAMB AI DubStudio","how-to-use-dubstudio,what-is-dubstream,how-to-dub-with-camb-ai",4
learn,ai-dubbing-languages-supported,What Languages Does AI Dubbing Support?,Fundamentals,planned,P0,"AI dubbing languages, dubbing language list","what-languages-can-ai-dub,ai-dubbing-in-spanish,how-to-localize-content-150-languages",5
learn,voice-preservation-in-dubbing,How AI Preserves Your Voice Across Languages,Fundamentals,planned,P0,"voice preservation dubbing, keep voice dubbing","voice-cloning-for-dubbing,can-ai-preserve-voice-other-language,how-voice-cloning-works",5
learn,emotion-transfer-in-ai-dubbing,How AI Transfers Emotion and Tone in Dubbing,Fundamentals,planned,P1,"emotion dubbing AI, emotional AI dubbing","emotion-detection-dubbing,prosody-transfer-deep-dive,what-is-expressive-tts",5
learn,multi-speaker-dubbing,How AI Handles Multiple Speakers in Dubbing,Fundamentals,planned,P1,"multi-speaker dubbing, multiple voices dubbing","speaker-diarization-explained,multi-speaker-isolation-overlapping-voices-live-sports,ai-dubbing-for-video",5
learn,ambient-sound-preservation,How AI Preserves Background Audio During Dubbing,Fundamentals,planned,P2,"ambient sound dubbing, background audio preservation","noise-reduction-in-dubbing,how-does-ai-dubbing-work,audio-codec-quality",6
learn,ai-dubbing-turnaround-time,How Long Does AI Dubbing Take?,Fundamentals,planned,P1,"AI dubbing time, how fast AI dubbing","ai-dubbing-cost-per-minute,async-vs-realtime-dubbing,what-is-dubstream",6
learn,ai-dubbing-file-formats,What File Formats Does AI Dubbing Support?,Fundamentals,planned,P2,"dubbing file formats, video formats AI dubbing","how-to-dub-with-camb-ai,audio-codec-quality,sample-rate-and-bitrate",6
learn,youtube-auto-dubbing-explained,What Is YouTube Auto-Dubbing?,Fundamentals,planned,P0,"YouTube auto dubbing, YouTube automatic dubbing","youtube-auto-dubbing-vs-professional,ai-dubbing-for-youtube,youtube-dubbing-how-to",6
learn,youtube-auto-dubbing-vs-professional,YouTube Auto-Dubbing vs Professional AI Dubbing Tools,Fundamentals,planned,P0,"YouTube dubbing vs professional, YouTube vs CAMB AI","youtube-auto-dubbing-explained,best-ai-dubbing-for-youtube,ai-dubbing-quality-2026",7
learn,ai-dubbing-for-short-form,AI Dubbing for Short-Form Video: TikTok Reels and Shorts,Fundamentals,planned,P1,"AI dubbing TikTok, dub Reels Shorts","ai-dubbing-for-tiktok,ai-dubbing-for-instagram,how-to-dub-tiktok-video",7
learn,what-is-dubbing-api,What Is a Dubbing API?,Fundamentals,planned,P1,"dubbing API, AI dubbing API","how-to-integrate-dubbing-api,best-dubbing-api,tts-api-guide",7
learn,ai-dubbing-for-podcasts,AI Dubbing for Podcasts: How It Works,Fundamentals,planned,P1,"podcast dubbing AI, translate podcast","ai-dubbing-for-podcasters,how-to-dub-podcast,how-to-create-multilingual-podcast",7
learn,ai-dubbing-for-audiobooks,AI Dubbing for Audiobooks: Localize at Scale,Fundamentals,planned,P1,"audiobook dubbing, audiobook localization AI","voice-cloning-for-audiobooks,ai-dubbing-for-audio,how-to-dub-podcast",8
learn,does-ai-dubbing-sound-robotic,Does AI Dubbing Sound Robotic?,Fundamentals,planned,P0,"AI dubbing robotic, AI dubbing natural","ai-dubbing-quality-2026,is-ai-dubbing-good-enough,what-is-expressive-tts",8
learn,ai-dubbing-script-or-no-script,Do You Need a Script for AI Dubbing?,Fundamentals,planned,P1,"AI dubbing script, dubbing without script","how-does-ai-dubbing-work,transcription-for-dubbing,how-to-dub-with-camb-ai",8
learn,what-is-voice-cloning,What Is Voice Cloning?,Voice Cloning,planned,P0,"what is voice cloning, AI voice cloning","how-voice-cloning-works,zero-shot-voice-cloning-explained,voice-cloning-ethics",2
learn,how-voice-cloning-works,How Does AI Voice Cloning Work?,Voice Cloning,planned,P0,"how voice cloning works, voice cloning technology","what-is-voice-cloning,voice-cloning-architecture,voice-cloning-from-short-audio",2
learn,zero-shot-voice-cloning-explained,What Is Zero-Shot Voice Cloning?,Voice Cloning,planned,P0,"zero-shot voice cloning, instant voice clone","what-is-voice-cloning,voice-cloning-from-short-audio,glossary-zero-shot",3
learn,voice-cloning-vs-text-to-speech,Voice Cloning vs Text-to-Speech: Key Differences,Voice Cloning,planned,P1,"voice cloning vs TTS, clone vs synthesize","what-is-voice-cloning,what-is-text-to-speech,tts-vs-voice-cloning",3
learn,voice-cloning-from-short-audio,How Little Audio Do You Need to Clone a Voice?,Voice Cloning,planned,P0,"voice cloning minimum audio, 2 second voice clone","what-is-voice-cloning,voice-cloning-accuracy,mars8-model-family",3
learn,voice-cloning-accuracy,How Accurate Is AI Voice Cloning?,Voice Cloning,planned,P1,"voice cloning accuracy, speaker similarity score","voice-cloning-quality-comparison,voice-cloning-from-short-audio,model-evaluation-dubbing",4
learn,voice-cloning-ethics,Is Voice Cloning Ethical? Consent and Safety Guide,Voice Cloning,planned,P0,"voice cloning ethics, voice cloning consent","voice-cloning-legal,voice-cloning-deepfake-difference,voice-cloning-security",4
learn,voice-cloning-legal,Is Voice Cloning Legal? Regulations by Country,Voice Cloning,planned,P0,"voice cloning legal, voice cloning law, EU AI Act voice","voice-cloning-ethics,dubbing-compliance-regulations,voice-cloning-security",4
learn,voice-cloning-for-dubbing,How Voice Cloning Enables Natural Dubbing,Voice Cloning,planned,P0,"voice cloning dubbing, clone voice for translation","voice-preservation-in-dubbing,what-is-voice-cloning,how-to-clone-voice-for-dubbing",5
learn,voice-cloning-for-podcasts,Voice Cloning for Podcasters: Speak in Every Language,Voice Cloning,planned,P1,"voice cloning podcast, podcast voice clone","ai-dubbing-for-podcasters,how-to-dub-podcast,voice-cloning-for-content-creators",5
learn,voice-cloning-for-audiobooks,Voice Cloning for Audiobooks: Scale Narration,Voice Cloning,planned,P1,"voice cloning audiobook, audiobook narrator clone","ai-dubbing-for-audiobooks,voice-cloning-use-cases,how-voice-cloning-works",6
learn,voice-cloning-for-elearning,Voice Cloning for E-Learning: Instructor Voice Preservation,Voice Cloning,planned,P1,"voice cloning e-learning, instructor voice clone","ai-dubbing-for-elearning,ai-dubbing-for-educators,how-to-dub-online-course",6
learn,voice-cloning-for-marketing,Voice Cloning for Marketing and Advertising,Voice Cloning,planned,P2,"voice cloning marketing, brand voice clone","voice-cloning-for-advertising,how-to-preserve-brand-voice,ai-dubbing-for-advertising",7
learn,voice-cloning-deepfake-difference,Voice Cloning vs Deepfakes: What Is the Difference?,Voice Cloning,planned,P1,"voice cloning vs deepfake, is voice cloning deepfake","voice-cloning-ethics,voice-cloning-security,voice-cloning-legal",7
learn,voice-cloning-security,How to Prevent Unauthorized Voice Cloning,Voice Cloning,planned,P1,"voice cloning security, protect voice from cloning","voice-cloning-ethics,voice-cloning-legal,speaker-verification-explained",8
learn,voice-embeddings-explained,What Are Voice Embeddings?,Voice Cloning,planned,P2,"voice embeddings, speaker embeddings AI","speaker-embedding-models,speaker-verification-explained,how-voice-cloning-works",8
learn,speaker-verification-explained,What Is Speaker Verification?,Voice Cloning,planned,P2,"speaker verification, voice identity AI","voice-embeddings-explained,voice-cloning-security,speaker-embedding-models",9
learn,voice-cloning-quality-comparison,Voice Cloning Quality: MARS8 vs ElevenLabs vs Competitors,Voice Cloning,planned,P0,"voice cloning quality comparison, best voice clone","camb-ai-vs-elevenlabs,mars8-model-family,voice-cloning-accuracy",9
learn,voice-cloning-use-cases,10 Real-World Voice Cloning Use Cases,Voice Cloning,planned,P1,"voice cloning use cases, voice cloning applications","what-is-voice-cloning,voice-cloning-for-dubbing,voice-cloning-for-content-creators",10
learn,voice-cloning-for-content-creators,Voice Cloning for Content Creators: Go Global with Your Voice,Voice Cloning,planned,P1,"creator voice cloning, content creator voice clone","ai-dubbing-for-content-creators,how-to-build-multilingual-youtube,voice-cloning-for-podcasts",10
learn,what-is-ai-translation,What Is AI Translation?,Translation,planned,P0,"AI translation, what is AI translation","what-is-ai-localization,translation-vs-localization,what-is-neural-machine-translation",3
learn,what-is-ai-localization,What Is AI Localization?,Translation,planned,P0,"AI localization, what is localization AI","what-is-ai-translation,translation-vs-localization,content-localization-strategy",3
learn,translation-vs-localization,Translation vs Localization: What Is the Difference?,Translation,planned,P0,"translation vs localization, localize vs translate","what-is-ai-translation,what-is-ai-localization,what-is-transcreation",3
learn,what-is-transcreation,What Is Transcreation?,Translation,planned,P1,"transcreation, creative translation","translation-vs-localization,localization-vs-transcreation,cultural-adaptation-in-dubbing",4
learn,localization-vs-transcreation,Localization vs Transcreation: When to Use Each,Translation,planned,P2,"localization vs transcreation","what-is-transcreation,translation-vs-localization,content-localization-strategy",4
learn,what-is-neural-machine-translation,What Is Neural Machine Translation (NMT)?,Translation,planned,P1,"neural machine translation, NMT","what-is-ai-translation,neural-machine-translation-architecture,glossary-nmt",5
learn,real-time-ai-translation,What Is Real-Time AI Translation?,Translation,planned,P0,"real-time AI translation, live AI translation","real-time-ai-dubbing-explained,can-ai-do-real-time-translation,simultaneous-interpretation-vs-ai",5
learn,speech-to-speech-translation,What Is Speech-to-Speech Translation?,Translation,planned,P0,"speech to speech translation, S2ST","how-does-ai-dubbing-work,how-ai-dubbing-pipeline-works,what-is-ai-voice-translation",5
learn,ai-translation-accuracy-2026,How Accurate Is AI Translation in 2026?,Translation,planned,P1,"AI translation accuracy, machine translation quality","ai-dubbing-accuracy,model-evaluation-dubbing,how-to-measure-dubbing-quality",6
learn,app-localization-guide,How to Localize an App for Global Markets,Translation,planned,P1,"app localization, localize app AI","how-to-localize-app,localization-for-saas,multilingual-seo",6
learn,website-localization-guide,How to Localize a Website with AI,Translation,planned,P1,"website localization, localize website","how-to-localize-website,multilingual-seo,hreflang-tags-explained",6
learn,game-localization-guide,How to Localize a Video Game with AI,Translation,planned,P1,"game localization, video game translation","ai-dubbing-for-gaming,how-to-localize-game,voice-cloning-for-gaming",7
learn,video-localization-explained,What Is Video Localization?,Translation,planned,P0,"video localization, localize video","what-is-ai-dubbing,ai-dubbing-for-video,how-to-translate-video-to-another-language",7
learn,audio-localization-explained,What Is Audio Localization?,Translation,planned,P1,"audio localization, localize audio content","ai-dubbing-for-audio,ai-dubbing-for-podcasts,video-localization-explained",7
