type,slug,title,category,status,priority,target_keywords,related_slugs,scheduled_week
learn,spanish-to-english-dubbing,Spanish to English AI Dubbing,Language Pair,planned,P0,"Spanish to English dubbing","english-to-spanish-dubbing,ai-dubbing-in-spanish,how-to-dub-telenovela",6
learn,hindi-to-english-dubbing,Hindi to English AI Dubbing,Language Pair,planned,P1,"Hindi to English dubbing","english-to-hindi-dubbing,ai-dubbing-in-hindi,ai-dubbing-languages-supported",7
learn,japanese-to-english-dubbing,Japanese to English AI Dubbing,Language Pair,planned,P1,"Japanese to English dubbing, anime dubbing AI","english-to-japanese-dubbing,how-to-dub-anime,ai-dubbing-in-japanese",7
learn,korean-to-english-dubbing,Korean to English AI Dubbing,Language Pair,planned,P1,"Korean to English dubbing, K-drama dubbing AI","english-to-korean-dubbing,how-to-dub-kdrama,ai-dubbing-in-korean",8
learn,french-to-english-dubbing,French to English AI Dubbing,Language Pair,planned,P1,"French to English dubbing","english-to-french-dubbing,ai-dubbing-in-french,ai-dubbing-languages-supported",8
learn,german-to-english-dubbing,German to English AI Dubbing,Language Pair,planned,P2,"German to English dubbing","english-to-german-dubbing,ai-dubbing-in-german,ai-dubbing-languages-supported",9
learn,arabic-to-english-dubbing,Arabic to English AI Dubbing,Language Pair,planned,P1,"Arabic to English dubbing","english-to-arabic-dubbing,ai-dubbing-in-arabic,rtl-language-localization",9
learn,portuguese-to-english-dubbing,Portuguese to English AI Dubbing,Language Pair,planned,P2,"Portuguese to English dubbing","english-to-portuguese-dubbing,ai-dubbing-in-portuguese,ai-dubbing-languages-supported",10
learn,english-to-tamil-dubbing,English to Tamil AI Dubbing,Language Pair,planned,P1,"English to Tamil dubbing","ai-dubbing-in-tamil,english-to-hindi-dubbing,ai-dubbing-languages-supported",10
learn,english-to-bengali-dubbing,English to Bengali AI Dubbing,Language Pair,planned,P2,"English to Bengali dubbing","ai-dubbing-in-bengali,english-to-hindi-dubbing,ai-dubbing-languages-supported",11
learn,english-to-telugu-dubbing,English to Telugu AI Dubbing,Language Pair,planned,P2,"English to Telugu dubbing","ai-dubbing-in-telugu,english-to-tamil-dubbing,ai-dubbing-languages-supported",11
learn,mandarin-to-english-dubbing,Mandarin to English AI Dubbing,Language Pair,planned,P1,"Chinese to English dubbing","english-to-mandarin-dubbing,ai-dubbing-in-mandarin,ai-dubbing-languages-supported",12
learn,english-to-filipino-dubbing,English to Filipino AI Dubbing,Language Pair,planned,P2,"English to Filipino dubbing","ai-dubbing-in-filipino,english-to-indonesian-dubbing,ai-dubbing-languages-supported",12
learn,english-to-swahili-dubbing,English to Swahili AI Dubbing,Language Pair,planned,P2,"English to Swahili dubbing","ai-dubbing-in-swahili,ai-dubbing-languages-supported,english-to-arabic-dubbing",13
learn,english-to-urdu-dubbing,English to Urdu AI Dubbing,Language Pair,planned,P2,"English to Urdu dubbing","ai-dubbing-in-urdu,english-to-hindi-dubbing,ai-dubbing-languages-supported",13
learn,how-to-dub-a-movie,How to Dub a Movie with AI: Step-by-Step,How-To,planned,P0,"how to dub a movie, movie dubbing tutorial","ai-dubbing-for-entertainment,how-does-ai-dubbing-work,lip-sync-for-film",5
learn,how-to-dub-youtube-video,How to Dub a YouTube Video into Multiple Languages,How-To,planned,P0,"dub YouTube video, YouTube dubbing tutorial","ai-dubbing-for-youtube,how-to-build-multilingual-youtube,best-ai-dubbing-for-youtube",5
learn,how-to-dub-podcast,How to Dub a Podcast Episode with AI,How-To,planned,P1,"dub podcast, podcast translation how-to","ai-dubbing-for-podcasters,how-to-create-multilingual-podcast,voice-cloning-for-podcasts",6
learn,how-to-dub-online-course,How to Dub an Online Course for Global Students,How-To,planned,P1,"dub online course, localize course tutorial","ai-dubbing-for-elearning,ai-dubbing-for-educators,voice-cloning-for-elearning",6
learn,how-to-dub-corporate-video,How to Dub a Corporate Training Video,How-To,planned,P1,"dub corporate video, training video translation","ai-dubbing-for-corporate,ai-dubbing-for-training-videos,ai-dubbing-for-hr-teams",7
learn,how-to-dub-documentary,How to Dub a Documentary with AI,How-To,planned,P1,"dub documentary, documentary translation","ai-dubbing-for-documentaries,how-to-dub-a-movie,ai-dubbing-for-entertainment",7
learn,how-to-dub-ad,How to Dub an Advertisement for International Markets,How-To,planned,P1,"dub ad, ad localization tutorial","ai-dubbing-for-advertising,voice-cloning-for-advertising,how-to-localize-marketing-content",8
learn,how-to-dub-tiktok-video,How to Dub a TikTok Video into Another Language,How-To,planned,P1,"dub TikTok, TikTok dubbing tutorial","ai-dubbing-for-tiktok,ai-dubbing-for-short-form,how-to-dub-instagram-reel",8
learn,how-to-dub-instagram-reel,How to Dub an Instagram Reel with AI,How-To,planned,P2,"dub Instagram Reel, Reel translation","ai-dubbing-for-instagram,how-to-dub-tiktok-video,ai-dubbing-for-short-form",9
learn,how-to-set-up-live-dubbing,How to Set Up Real-Time AI Dubbing for a Live Event,How-To,planned,P0,"set up live dubbing, real-time dubbing setup","what-is-dubstream,how-to-use-dubstream,how-to-set-up-srt-rtmp-dubbing",6
learn,how-to-integrate-dubbing-api,How to Integrate a Dubbing API into Your App,How-To,planned,P0,"dubbing API integration, CAMB AI API setup","what-is-dubbing-api,how-to-use-camb-ai-python-sdk,tts-api-guide",6
learn,how-to-clone-voice-for-dubbing,How to Clone Your Voice for Multilingual Dubbing,How-To,planned,P0,"clone voice dubbing, voice clone for translation","voice-cloning-for-dubbing,voice-cloning-from-short-audio,how-to-dub-with-camb-ai",7
learn,how-to-choose-dubbing-platform,How to Choose the Right AI Dubbing Platform,How-To,planned,P0,"choose dubbing platform, best dubbing tool","best-ai-dubbing-tools-2026,camb-ai-vs-elevenlabs,best-video-localization-platforms",7
learn,how-to-localize-app,How to Localize Your App with AI Translation,How-To,planned,P1,"localize app, app localization guide","app-localization-guide,localization-for-saas,multilingual-seo",8
learn,how-to-localize-game,How to Localize a Video Game with AI Dubbing,How-To,planned,P1,"localize game, game localization guide","game-localization-guide,ai-dubbing-for-gaming,best-game-localization-tools",8
learn,how-to-localize-website,How to Localize Your Website for International Markets,How-To,planned,P1,"localize website, website translation guide","website-localization-guide,multilingual-seo,hreflang-tags-explained",9
learn,how-to-localize-marketing-content,How to Localize Marketing Content Across Regions,How-To,planned,P1,"localize marketing, marketing localization","ai-dubbing-for-advertising,how-to-preserve-brand-voice,ai-dubbing-for-marketers",9
learn,how-to-measure-dubbing-quality,How to Measure AI Dubbing Quality (MOS BLEU COMET),How-To,planned,P1,"measure dubbing quality, MOS score dubbing","model-evaluation-dubbing,benchmark-dubbing-tools,ai-dubbing-quality-2026",10
learn,how-to-set-up-srt-rtmp-dubbing,How to Set Up SRT/RTMP Streams for Live Dubbing,How-To,planned,P1,"SRT dubbing, RTMP live dubbing setup","srt-rtmp-hls-protocols,streaming-architecture-dubstream,how-to-use-dubstream",10
learn,how-to-dub-anime,How to Dub Anime with AI,How-To,planned,P0,"dub anime AI, anime dubbing","ai-dubbing-in-japanese,japanese-to-english-dubbing,ai-dubbing-for-entertainment",7
learn,how-to-dub-kdrama,How to Dub K-Dramas with AI,How-To,planned,P0,"dub K-drama, Korean drama dubbing","ai-dubbing-in-korean,korean-to-english-dubbing,ai-dubbing-for-entertainment",7
learn,how-to-dub-telenovela,How to Dub a Telenovela with AI,How-To,planned,P2,"dub telenovela, Spanish drama dubbing","ai-dubbing-in-spanish,spanish-to-english-dubbing,ai-dubbing-for-entertainment",10
learn,how-to-dub-sermon,How to Dub a Sermon or Religious Content,How-To,planned,P2,"dub sermon, religious content translation","ai-dubbing-for-religious-content,ai-dubbing-for-audio,how-to-dub-with-camb-ai",11
learn,how-to-build-multilingual-youtube,How to Build a Multilingual YouTube Channel with AI,How-To,planned,P0,"multilingual YouTube, YouTube multiple languages","ai-dubbing-for-youtube,how-to-dub-youtube-video,best-ai-dubbing-for-youtube",6
learn,how-to-expand-to-new-markets,How to Use AI Dubbing to Expand to New Markets,How-To,planned,P1,"expand markets dubbing, market expansion localization","dubbing-for-revenue-growth,content-globalization-playbook,localization-roi",10
learn,how-to-dub-with-camb-ai,How to Dub with CAMB AI: Complete Getting Started Guide,How-To,planned,P0,"CAMB AI tutorial, how to use CAMB AI","how-to-use-dubstudio,how-to-use-dubstream,how-to-integrate-dubbing-api",5
learn,how-to-use-dubstudio,How to Use DubStudio: Step-by-Step Tutorial,How-To,planned,P0,"DubStudio tutorial, DubStudio how-to","what-is-dubstudio,how-to-dub-with-camb-ai,how-to-quality-check-dubbed-content",5
learn,how-to-use-dubstream,How to Use DubStream for Live Translation,How-To,planned,P0,"DubStream tutorial, DubStream how-to","what-is-dubstream,how-to-set-up-live-dubbing,how-to-set-up-srt-rtmp-dubbing",6
learn,how-to-quality-check-dubbed-content,How to QA and Review AI-Dubbed Content,How-To,planned,P1,"QA dubbing, review dubbed content","how-to-measure-dubbing-quality,localization-testing,human-in-the-loop-dubbing",10
learn,how-to-handle-dubbing-edge-cases,How to Handle Edge Cases in AI Dubbing (Idioms Songs Names),How-To,planned,P2,"dubbing edge cases, idiom translation dubbing","cultural-adaptation-in-dubbing,how-to-quality-check-dubbed-content,localization-testing",11
learn,how-to-dub-with-make-com,How to Automate AI Dubbing with Make.com,How-To,planned,P1,"CAMB AI Make.com, dubbing automation","how-to-integrate-dubbing-api,how-to-batch-dub-video-library,dubbing-workflow-best-practices",11
learn,how-to-use-camb-ai-python-sdk,How to Use the CAMB AI Python SDK,How-To,planned,P0,"CAMB AI Python SDK, Python dubbing API","how-to-use-camb-ai-node-sdk,how-to-integrate-dubbing-api,tts-api-guide",8
learn,how-to-use-camb-ai-node-sdk,How to Use the CAMB AI Node.js SDK,How-To,planned,P1,"CAMB AI Node SDK, Node.js dubbing API","how-to-use-camb-ai-python-sdk,how-to-integrate-dubbing-api,tts-api-guide",9
learn,how-to-batch-dub-video-library,How to Batch Dub an Entire Video Library,How-To,planned,P1,"batch dubbing, bulk video dubbing","how-to-dub-with-make-com,dubbing-workflow-best-practices,how-to-integrate-dubbing-api",10
learn,how-to-preserve-brand-voice,How to Preserve Your Brand Voice Across Languages,How-To,planned,P1,"brand voice localization, consistent brand voice","voice-cloning-for-marketing,how-to-localize-marketing-content,voice-preservation-in-dubbing",11
learn,pre-dubbing-checklist,The Pre-Dubbing Checklist: Preparing Content for AI Translation,How-To,planned,P1,"pre-dubbing checklist, dubbing preparation","dubbing-workflow-best-practices,how-to-dub-with-camb-ai,how-to-quality-check-dubbed-content",11
learn,how-to-dub-webinar-recording,How to Dub a Webinar Recording for Global Audiences,How-To,planned,P2,"dub webinar, webinar localization","ai-dubbing-for-webinars,how-to-dub-corporate-video,realtime-translation-for-webinars",12
learn,how-to-create-multilingual-podcast,How to Create a Multilingual Podcast with AI,How-To,planned,P1,"multilingual podcast, podcast AI translation","how-to-dub-podcast,ai-dubbing-for-podcasters,voice-cloning-for-podcasts",12
learn,dubbing-workflow-best-practices,AI Dubbing Workflow Best Practices for Teams,How-To,planned,P1,"dubbing workflow, dubbing best practices","localization-workflow,pre-dubbing-checklist,how-to-quality-check-dubbed-content",12
learn,how-to-dub-user-generated-content,How to Dub User-Generated Content at Scale,How-To,planned,P2,"dub UGC, UGC localization","how-to-batch-dub-video-library,ai-dubbing-for-short-form,ai-dubbing-for-youtube",13
learn,camb-ai-vs-elevenlabs,CAMB AI vs ElevenLabs: Feature-by-Feature Comparison,Comparison,planned,P0,"CAMB AI vs ElevenLabs, ElevenLabs vs CAMB","elevenlabs-alternative,voice-cloning-quality-comparison,best-ai-dubbing-tools-2026",3
learn,camb-ai-vs-rask-ai,CAMB AI vs Rask AI: Which AI Dubbing Platform Is Better?,Comparison,planned,P0,"CAMB AI vs Rask AI, Rask vs CAMB","rask-ai-alternative,best-ai-dubbing-tools-2026,best-video-localization-platforms",3
learn,camb-ai-vs-heygen,CAMB AI vs HeyGen: Real Voice vs AI Avatars,Comparison,planned,P0,"CAMB AI vs HeyGen, HeyGen vs CAMB","heygen-alternative,best-ai-dubbing-tools-2026,voice-cloning-quality-comparison",4
learn,camb-ai-vs-deepl,CAMB AI vs DeepL: Video Dubbing vs Text Translation,Comparison,planned,P1,"CAMB AI vs DeepL, DeepL dubbing","deepl-alternative-video,best-ai-translation-tools-2026,what-is-ai-translation",5
learn,camb-ai-vs-synthesia,CAMB AI vs Synthesia: Dubbing vs Avatar Videos,Comparison,planned,P1,"CAMB AI vs Synthesia","synthesia-alternative,camb-ai-vs-heygen,best-video-localization-platforms",5
learn,camb-ai-vs-papercup,CAMB AI vs Papercup (RWS): AI Dubbing Comparison,Comparison,planned,P1,"CAMB AI vs Papercup","papercup-alternative,best-ai-dubbing-tools-2026,camb-ai-vs-deepdub",6
learn,camb-ai-vs-deepdub,CAMB AI vs Deepdub: Enterprise Dubbing Compared,Comparison,planned,P1,"CAMB AI vs Deepdub","camb-ai-vs-papercup,best-ai-dubbing-for-enterprises,ai-dubbing-for-enterprises",6
learn,camb-ai-vs-murf,CAMB AI vs Murf AI,Comparison,planned,P2,"CAMB AI vs Murf","best-tts-engines-2026,tts-engines-compared,camb-ai-vs-elevenlabs",8
learn,camb-ai-vs-resemble,CAMB AI vs Resemble AI,Comparison,planned,P2,"CAMB AI vs Resemble AI","voice-cloning-quality-comparison,camb-ai-vs-elevenlabs,best-voice-cloning-tools-2026",8
learn,camb-ai-vs-speechify,CAMB AI vs Speechify,Comparison,planned,P2,"CAMB AI vs Speechify","best-tts-engines-2026,tts-engines-compared,camb-ai-vs-murf",9
learn,camb-ai-vs-dubverse,CAMB AI vs Dubverse,Comparison,planned,P1,"CAMB AI vs Dubverse","dubverse-alternative,best-ai-dubbing-tools-2026,camb-ai-vs-rask-ai",7
learn,rask-ai-vs-elevenlabs,Rask AI vs ElevenLabs: AI Dubbing Comparison,Comparison,planned,P1,"Rask AI vs ElevenLabs","camb-ai-vs-rask-ai,camb-ai-vs-elevenlabs,best-ai-dubbing-tools-2026",8
learn,heygen-vs-synthesia,HeyGen vs Synthesia: AI Video Platform Comparison,Comparison,planned,P1,"HeyGen vs Synthesia","camb-ai-vs-heygen,camb-ai-vs-synthesia,best-video-localization-platforms",9
learn,elevenlabs-vs-deepdub,ElevenLabs vs Deepdub: Voice Cloning and Dubbing,Comparison,planned,P2,"ElevenLabs vs Deepdub","camb-ai-vs-elevenlabs,camb-ai-vs-deepdub,voice-cloning-quality-comparison",10
learn,rask-ai-vs-heygen,Rask AI vs HeyGen: Which Is Better for Video?,Comparison,planned,P2,"Rask vs HeyGen","camb-ai-vs-rask-ai,camb-ai-vs-heygen,best-video-localization-platforms",10
learn,elevenlabs-alternative,Best ElevenLabs Alternative for AI Dubbing,Alternative,planned,P0,"ElevenLabs alternative, better than ElevenLabs","camb-ai-vs-elevenlabs,best-ai-dubbing-tools-2026,best-elevenlabs-alternative-dubbing",4
learn,rask-ai-alternative,Best Rask AI Alternative for Video Dubbing,Alternative,planned,P0,"Rask AI alternative","camb-ai-vs-rask-ai,best-ai-dubbing-tools-2026,best-rask-ai-alternative",4
learn,heygen-alternative,Best HeyGen Alternative for Video Localization,Alternative,planned,P0,"HeyGen alternative","camb-ai-vs-heygen,best-video-localization-platforms,best-heygen-alternative-dubbing",5
learn,deepl-alternative-video,Best DeepL Alternative for Video Translation,Alternative,planned,P1,"DeepL alternative video","camb-ai-vs-deepl,best-ai-translation-tools-2026,best-video-localization-platforms",6
learn,synthesia-alternative,Best Synthesia Alternative for Localized Video,Alternative,planned,P1,"Synthesia alternative","camb-ai-vs-synthesia,camb-ai-vs-heygen,best-video-localization-platforms",7
learn,papercup-alternative,Best Papercup Alternative After RWS Acquisition,Alternative,planned,P1,"Papercup alternative","camb-ai-vs-papercup,best-ai-dubbing-tools-2026,camb-ai-vs-deepdub",8
learn,dubverse-alternative,Best Dubverse Alternative for AI Dubbing,Alternative,planned,P2,"Dubverse alternative","camb-ai-vs-dubverse,best-ai-dubbing-tools-2026,camb-ai-vs-rask-ai",9
learn,best-ai-dubbing-tools-2026,Best AI Dubbing Tools in 2026: Complete Ranking,Review,planned,P0,"best AI dubbing tools, top dubbing platforms 2026","what-is-the-best-ai-dubbing-tool,how-to-choose-dubbing-platform,camb-ai-vs-elevenlabs",4
learn,best-voice-cloning-tools-2026,Best Voice Cloning Tools in 2026,Review,planned,P0,"best voice cloning tools, top voice cloning","voice-cloning-quality-comparison,what-is-voice-cloning,camb-ai-vs-elevenlabs",4
learn,best-ai-translation-tools-2026,Best AI Translation Tools in 2026,Review,planned,P1,"best AI translation tools","best-video-localization-platforms,camb-ai-vs-deepl,what-is-ai-translation",5
learn,best-video-localization-platforms,Best Video Localization Platforms Compared,Review,planned,P0,"best video localization, localization platform","best-ai-dubbing-tools-2026,how-to-choose-dubbing-platform,video-localization-explained",5
learn,best-realtime-translation-tools,Best Real-Time Translation Tools in 2026,Review,planned,P0,"best real-time translation, live translation tools","real-time-ai-translation,what-is-dubstream,best-ai-dubbing-tools-2026",6
learn,best-ai-dubbing-tools-free,Best Free AI Dubbing Tools in 2026,Review,planned,P0,"free AI dubbing, free dubbing tool","best-free-dubbing-tool,best-ai-dubbing-tools-2026,youtube-auto-dubbing-explained",6
learn,best-tts-engines-2026,Best Text-to-Speech Engines in 2026,Review,planned,P1,"best TTS, top text to speech","tts-engines-compared,mars8-model-family,what-is-neural-tts",7
learn,best-dubbing-api,Best Dubbing APIs for Developers in 2026,Review,planned,P1,"best dubbing API, dubbing API comparison","what-is-dubbing-api,how-to-integrate-dubbing-api,ai-dubbing-for-developers",8
learn,best-ai-dubbing-for-youtube,Best AI Dubbing Tools for YouTube Creators,Review,planned,P0,"best YouTube dubbing, YouTube dubbing tool","ai-dubbing-for-youtube,how-to-dub-youtube-video,youtube-auto-dubbing-vs-professional",7
learn,best-ai-dubbing-for-enterprises,Best AI Dubbing Platforms for Enterprise,Review,planned,P1,"enterprise dubbing, best enterprise dubbing","ai-dubbing-for-enterprises,ai-dubbing-for-enterprise-teams,enterprise-localization-strategy",8
learn,best-podcast-dubbing-tools,Best AI Tools for Podcast Dubbing,Review,planned,P1,"podcast dubbing tools, best podcast translation","ai-dubbing-for-podcasters,how-to-dub-podcast,how-to-create-multilingual-podcast",9
learn,best-game-localization-tools,Best AI Tools for Game Localization,Review,planned,P1,"game localization tools, best game dubbing","ai-dubbing-for-gaming,game-localization-guide,ai-dubbing-for-game-studios",9
learn,how-ai-dubbing-pipeline-works,The AI Dubbing Pipeline: End-to-End Technical Guide,Technical,planned,P0,"AI dubbing pipeline, dubbing architecture","how-does-ai-dubbing-work,speech-to-speech-translation,transcription-for-dubbing",6
learn,prosody-transfer-deep-dive,Prosody Transfer in AI Dubbing: Technical Deep-Dive,Technical,planned,P1,"prosody transfer, tone transfer technology","prosody-transfer-explained,what-is-prosody,emotion-transfer-in-ai-dubbing",8
learn,speaker-diarization-explained,What Is Speaker Diarization?,Technical,planned,P1,"speaker diarization, speaker separation","multi-speaker-dubbing,glossary-speaker-diarization,speaker-embedding-models",8
learn,neural-machine-translation-architecture,How Neural Machine Translation Works,Technical,planned,P2,"NMT architecture, neural translation","what-is-neural-machine-translation,glossary-nmt,ai-translation-accuracy-2026",9
learn,attention-mechanisms-in-tts,Attention Mechanisms in Text-to-Speech,Technical,planned,P2,"attention mechanism TTS","what-is-neural-tts,tts-voices-explained,mars8-model-family",10
learn,audio-codec-quality,Audio Codecs and Quality in AI Dubbing,Technical,planned,P2,"audio codec dubbing, audio quality","sample-rate-and-bitrate,glossary-codec,ai-dubbing-file-formats",10
learn,latency-optimization-live-dubbing,How to Optimize Latency for Real-Time Dubbing,Technical,planned,P1,"dubbing latency, real-time latency optimization","streaming-architecture-dubstream,tts-latency,srt-rtmp-hls-protocols",9
learn,model-evaluation-dubbing,How to Evaluate AI Dubbing Models: MOS WER BLEU COMET,Technical,planned,P1,"MOS score, WER, BLEU score dubbing","how-to-measure-dubbing-quality,benchmark-dubbing-tools,glossary-mos-score",9
learn,api-architecture-dubbing-at-scale,Designing an API for Dubbing at Scale,Technical,planned,P2,"dubbing API architecture, scale dubbing","how-to-integrate-dubbing-api,gpu-infrastructure-dubbing,best-dubbing-api",11
learn,noise-reduction-in-dubbing,How AI Handles Noise Reduction in Dubbing,Technical,planned,P2,"noise reduction dubbing, audio processing","ambient-sound-preservation,audio-codec-quality,how-ai-dubbing-pipeline-works",11
learn,sample-rate-and-bitrate,Sample Rate and Bitrate in AI Audio: What Matters,Technical,planned,P2,"sample rate, bitrate audio quality","audio-codec-quality,glossary-sample-rate,glossary-bitrate",12
learn,srt-rtmp-hls-protocols,SRT vs RTMP vs HLS: Streaming Protocols for Live Dubbing,Technical,planned,P1,"SRT vs RTMP, streaming protocol dubbing","how-to-set-up-srt-rtmp-dubbing,streaming-architecture-dubstream,glossary-srt-protocol",10
learn,edge-deployment-ai-dubbing,Edge Deployment for AI Dubbing: MARS8-Nano,Technical,planned,P1,"edge AI dubbing, on-device dubbing","mars8-model-family,latency-optimization-live-dubbing,gpu-infrastructure-dubbing",11
learn,gpu-infrastructure-dubbing,GPU Infrastructure for AI Dubbing at Scale,Technical,planned,P2,"GPU dubbing, infrastructure AI dubbing","api-architecture-dubbing-at-scale,edge-deployment-ai-dubbing,latency-optimization-live-dubbing",12
learn,voice-cloning-architecture,Voice Cloning Architecture: How MARS8-Pro Works,Technical,planned,P1,"voice cloning architecture, MARS8 architecture","mars8-model-family,how-voice-cloning-works,voice-cloning-from-short-audio",10
learn,multilingual-model-training,How Multilingual AI Models Are Trained for 150+ Languages,Technical,planned,P1,"multilingual model training, 150 language AI","mars8-model-family,ai-dubbing-languages-supported,how-to-localize-content-150-languages",11
learn,emotion-detection-dubbing,How AI Detects and Preserves Emotion in Dubbing,Technical,planned,P1,"emotion detection dubbing, emotion preservation AI","emotion-transfer-in-ai-dubbing,prosody-transfer-deep-dive,what-is-expressive-tts",11
learn,timing-synchronization-dubbing,Timing and Synchronization in AI Dubbing,Technical,planned,P1,"dubbing timing, audio sync dubbing","how-ai-dubbing-pipeline-works,lip-sync-vs-audio-only,ai-lip-sync-explained",12
learn,speaker-embedding-models,Speaker Embedding Models Explained,Technical,planned,P2,"speaker embedding, voice representation","voice-embeddings-explained,speaker-diarization-explained,glossary-voice-embedding",13
learn,text-normalization-tts,Text Normalization for Multilingual TTS,Technical,planned,P2,"text normalization, TTS preprocessing","what-is-phoneme,tts-for-multilingual-content,multilingual-model-training",13
learn,voice-conversion-vs-cloning,Voice Conversion vs Voice Cloning: Technical Differences,Technical,planned,P2,"voice conversion vs cloning","what-is-voice-cloning,how-voice-cloning-works,voice-cloning-architecture",14
learn,streaming-architecture-dubstream,DubStream Architecture: How Real-Time Dubbing Works,Technical,planned,P0,"DubStream architecture, real-time dubbing tech","what-is-dubstream,latency-optimization-live-dubbing,srt-rtmp-hls-protocols",8
learn,open-source-dubbing-models,Open-Source AI Dubbing Models: MARS5-TTS and Beyond,Technical,planned,P1,"open source dubbing, MARS5 TTS","mars8-model-family,tts-engines-compared,voice-cloning-quality-comparison",12
learn,benchmark-dubbing-tools,How to Benchmark AI Dubbing Tools: Methodology Guide,Technical,planned,P1,"benchmark dubbing, compare dubbing quality","model-evaluation-dubbing,how-to-measure-dubbing-quality,best-ai-dubbing-tools-2026",13
learn,fine-tuning-voice-models,Fine-Tuning Voice Models for Custom Dubbing,Technical,planned,P2,"fine-tune voice model, custom voice training","voice-cloning-architecture,mars8-model-family,multilingual-model-training",14
learn,ai-dubbing-cost-analysis,AI Dubbing Cost Analysis: Complete Pricing Breakdown,Business,planned,P0,"AI dubbing cost, dubbing pricing breakdown","ai-dubbing-cost-per-minute,traditional-vs-ai-dubbing-cost,ai-dubbing-pricing-models",5
learn,ai-dubbing-pricing-models,AI Dubbing Pricing Models: Per-Minute vs Credit vs Enterprise,Business,planned,P1,"dubbing pricing models, per minute dubbing cost","ai-dubbing-cost-analysis,ai-dubbing-cost-per-minute,how-much-does-video-dubbing-cost",6
learn,dubbing-roi-calculator,How to Calculate ROI for AI Dubbing,Business,planned,P0,"dubbing ROI, ROI calculator dubbing","ai-dubbing-cost-analysis,localization-roi,dubbing-for-revenue-growth",6
learn,traditional-vs-ai-dubbing-cost,Traditional Dubbing vs AI Dubbing: Cost Comparison,Business,planned,P0,"traditional vs AI dubbing cost, 98% cost reduction","ai-dubbing-cost-analysis,ai-dubbing-vs-traditional-dubbing,ai-dubbing-cost-per-minute",5
learn,localization-market-by-region,Localization Market Opportunity by Region,Business,planned,P1,"localization market size, regional market opportunity","localization-market-opportunity,content-globalization-playbook,dubbing-market-trends-2026",8
learn,build-vs-buy-dubbing,Build vs Buy: In-House Dubbing vs AI Platform,Business,planned,P1,"build vs buy dubbing, in-house vs platform","enterprise-localization-strategy,how-to-choose-dubbing-platform,ai-dubbing-for-enterprises",8
